Welcome to Address Book Database

---UC1---
mysql> show databases;
+------------------------+
| Database               |
+------------------------+
| information_schema     |
| mysql                  |
| mysql_employee_payroll |
| payroll_service        |
| performance_schema     |
| sys                    |
+------------------------+
6 rows in set (6.99 sec)

mysql> create database address_book;
Query OK, 1 row affected (3.37 sec)

mysql> show databases;
+------------------------+
| Database               |
+------------------------+
| address_book           |
| information_schema     |
| mysql                  |
| mysql_employee_payroll |
| payroll_service        |
| performance_schema     |
| sys                    |
+------------------------+
7 rows in set (0.09 sec)

mysql> use address_book;
Database changed

---UC2---

mysql> create table addressbook
    -> (
    -> id          INT unsigned NOT NULL AUTO_INCREMENT,
    -> first_name  VARCHAR(150) NOT NULL,
    -> last_name   VARCHAR(150) NOT NULL,
    -> address     VARCHAR(250) NOT NULL,
    -> city        VARCHAR(150) NOT NULL,
    -> state       VARCHAR(150) NOT NULL,
    -> zip         INT NOT NULL,
    -> phone_number  INT NOT NULL,
    -> email       VARCHAR(150) NOT NULL,
    -> PRIMARY KEY    (id)
    -> );
Query OK, 0 rows affected (3.62 sec)

mysql> DESCRIBE addressbook;
+--------------+--------------+------+-----+---------+----------------+
| Field        | Type         | Null | Key | Default | Extra          |
+--------------+--------------+------+-----+---------+----------------+
| id           | int unsigned | NO   | PRI | NULL    | auto_increment |
| first_name   | varchar(150) | NO   |     | NULL    |                |
| last_name    | varchar(150) | NO   |     | NULL    |                |
| address      | varchar(250) | NO   |     | NULL    |                |
| city         | varchar(150) | NO   |     | NULL    |                |
| state        | varchar(150) | NO   |     | NULL    |                |
| zip          | int          | NO   |     | NULL    |                |
| phone_number | int          | NO   |     | NULL    |                |
| email        | varchar(150) | NO   |     | NULL    |                |
+--------------+--------------+------+-----+---------+----------------+
9 rows in set (0.26 sec)

---UC3---

mysql> INSERT INTO addressbook (first_name, last_name, address, city, state, zip, phone_number, email) VALUES
    -> ('Veeresh', 'SB', 'Haveri', 'Haveri', 'Karnataka', '588111', '123456123', 'veer@gmail.com'),
    -> ('Ronaldo', 'CR', 'Libson', 'Porto', 'Gao', '500111', '123456789', 'Cr@gmail.com'),
    -> ('Lionel', 'Messi', 'barca', 'Rico', 'Chennai', '522111', '689456789', 'lmessi@gmail.com');
Query OK, 3 rows affected (0.44 sec)
Records: 3  Duplicates: 0  Warnings: 0

mysql> SELECT * FROM addressbook;
+----+------------+-----------+---------+--------+-----------+--------+--------------+------------------+
| id | first_name | last_name | address | city   | state     | zip    | phone_number | email            |
+----+------------+-----------+---------+--------+-----------+--------+--------------+------------------+
|  1 | Veeresh    | SB        | Haveri  | Haveri | Karnataka | 588111 |    123456123 | veer@gmail.com   |
|  2 | Ronaldo    | CR        | Libson  | Porto  | Gao       | 500111 |    123456789 | Cr@gmail.com     |
|  3 | Lionel     | Messi     | barca   | Rico   | Chennai   | 522111 |    689456789 | lmessi@gmail.com |
+----+------------+-----------+---------+--------+-----------+--------+--------------+------------------+
3 rows in set (0.06 sec)

---UC4---

mysql> UPDATE addressbook SET email ='cris@gmail.com' WHERE last_name='CR';
Query OK, 1 row affected (0.18 sec)
Rows matched: 1  Changed: 1  Warnings: 0

mysql> SELECT * FROM addressbook;
+----+------------+-----------+---------+--------+-----------+--------+--------------+------------------+
| id | first_name | last_name | address | city   | state     | zip    | phone_number | email            |
+----+------------+-----------+---------+--------+-----------+--------+--------------+------------------+
|  1 | Veeresh    | SB        | Haveri  | Haveri | Karnataka | 588111 |    123456123 | veer@gmail.com   |
|  2 | Ronaldo    | CR        | Libson  | Porto  | Gao       | 500111 |    123456789 | cris@gmail.com   |
|  3 | Lionel     | Messi     | barca   | Rico   | Chennai   | 522111 |    689456789 | lmessi@gmail.com |
+----+------------+-----------+---------+--------+-----------+--------+--------------+------------------+
3 rows in set (0.04 sec)

---UC5---

mysql> DELETE FROM addressbook WHERE first_name='Lionel';
Query OK, 1 row affected (0.18 sec)

mysql> SELECT * FROM addressbook;
+----+------------+-----------+---------+--------+-----------+--------+--------------+----------------+
| id | first_name | last_name | address | city   | state     | zip    | phone_number | email          |
+----+------------+-----------+---------+--------+-----------+--------+--------------+----------------+
|  1 | Veeresh    | SB        | Haveri  | Haveri | Karnataka | 588111 |    123456123 | veer@gmail.com |
|  2 | Ronaldo    | CR        | Libson  | Porto  | Gao       | 500111 |    123456789 | cris@gmail.com |
+----+------------+-----------+---------+--------+-----------+--------+--------------+----------------+
2 rows in set (0.04 sec)

---UC6---

mysql> SELECT * FROM addressbook WHERE city='Haveri';
+----+------------+-----------+---------+--------+-----------+--------+--------------+----------------+
| id | first_name | last_name | address | city   | state     | zip    | phone_number | email          |
+----+------------+-----------+---------+--------+-----------+--------+--------------+----------------+
|  1 | Veeresh    | SB        | Haveri  | Haveri | Karnataka | 588111 |    123456123 | veer@gmail.com |
+----+------------+-----------+---------+--------+-----------+--------+--------------+----------------+
1 row in set (0.00 sec)

mysql> SELECT * FROM addressbook WHERE state='Gao';
+----+------------+-----------+---------+-------+-------+--------+--------------+----------------+
| id | first_name | last_name | address | city  | state | zip    | phone_number | email          |
+----+------------+-----------+---------+-------+-------+--------+--------------+----------------+
|  2 | Ronaldo    | CR        | Libson  | Porto | Gao   | 500111 |    123456789 | cris@gmail.com |
+----+------------+-----------+---------+-------+-------+--------+--------------+----------------+
1 row in set (0.00 sec)

---UC7---

mysql> SELECT COUNT(city), COUNT(state) FROM addressbook;
+-------------+--------------+
| COUNT(city) | COUNT(state) |
+-------------+--------------+
|           2 |            2 |
+-------------+--------------+
1 row in set (0.07 sec)

---UC8---

mysql> SELECT * FROM addressbook;
+----+------------+-----------+---------+--------+-----------+--------+--------------+----------------+
| id | first_name | last_name | address | city   | state     | zip    | phone_number | email          |
+----+------------+-----------+---------+--------+-----------+--------+--------------+----------------+
|  1 | Veeresh    | SB        | Haveri  | Haveri | Karnataka | 588111 |    123456123 | veer@gmail.com |
|  2 | Ronaldo    | CR        | Libson  | Porto  | Gao       | 500111 |    123456789 | cris@gmail.com |
+----+------------+-----------+---------+--------+-----------+--------+--------------+----------------+
2 rows in set (0.00 sec)

mysql> SELECT first_name FROM addressbook ORDER BY city;
+------------+
| first_name |
+------------+
| Veeresh    |
| Ronaldo    |
+------------+
2 rows in set (0.02 sec)

---UC9---

mysql> ALTER TABLE addressbook ADD AddressBookname VARCHAR(150) AFTER email;
Query OK, 0 rows affected (2.41 sec)
Records: 0  Duplicates: 0  Warnings: 0

mysql> ALTER TABLE addressbook ADD AddressBookType VARCHAR(150) AFTER AddressBookname;
Query OK, 0 rows affected (0.60 sec)
Records: 0  Duplicates: 0  Warnings: 0

mysql> UPDATE addressbook SET AddressBookname = 'AddressBook1', AddressBookType= 'Family' WHERE first_name = 'Veeresh';
Query OK, 1 row affected (0.30 sec)
Rows matched: 1  Changed: 1  Warnings: 0

mysql> UPDATE addressbook SET AddressBookname = 'AddressBook2', AddressBookType= 'Friend' WHERE first_name = 'Ronaldo';
Query OK, 1 row affected (0.13 sec)
Rows matched: 1  Changed: 1  Warnings: 0

mysql> SELECT * FROM addressbook;
+----+------------+-----------+---------+--------+-----------+--------+--------------+----------------+-----------------+-----------------+
| id | first_name | last_name | address | city   | state     | zip    | phone_number | email          | AddressBookname | AddressBookType |
+----+------------+-----------+---------+--------+-----------+--------+--------------+----------------+-----------------+-----------------+
|  1 | Veeresh    | SB        | Haveri  | Haveri | Karnataka | 588111 |    123456123 | veer@gmail.com | AddressBook1    | Family          |
|  2 | Ronaldo    | CR        | Libson  | Porto  | Gao       | 500111 |    123456789 | cris@gmail.com | AddressBook2    | Friend          |
+----+------------+-----------+---------+--------+-----------+--------+--------------+----------------+-----------------+-----------------+
2 rows in set (0.00 sec)

---UC10---

mysql> SELECT AddressBookType, count(*) FROM addressbook GROUP BY AddressBookType;
+-----------------+----------+
| AddressBookType | count(*) |
+-----------------+----------+
| Family          |        1 |
| Friend          |        1 |
+-----------------+----------+
2 rows in set (0.06 sec)

---UC11---

mysql> INSERT INTO addressbook (first_name, last_name, address, city, state, zip, phone_number, email, AddressBookname, AddressBookType) VALUES;
ERROR 1064 (42000): You have an error in your SQL syntax; check the manual that corresponds to your MySQL server version for the right syntax to use near '' at line 1
mysql> INSERT INTO addressbook (first_name, last_name, address, city, state, zip, phone_number, email, AddressBookname, AddressBookType) VALUES
    -> ('Mike', 'gibbs', 'LakeRoad', 'Hubli', 'UP', '581235', '789654113', 'mikeg@gmail.com', 'AddressBook3', 'Friend'),
    -> ('Paula', 'Patrick', 'Jaynagar', 'pune', 'Maharastra', '5486845', '39856214', 'paulapat@gmail.com', 'AddressBook4', 'Family');
Query OK, 2 rows affected (0.19 sec)
Records: 2  Duplicates: 0  Warnings: 0

mysql> SELECT * FROM addressbook;
+----+------------+-----------+----------+--------+------------+---------+--------------+--------------------+-----------------+-----------------+
| id | first_name | last_name | address  | city   | state      | zip     | phone_number | email              | AddressBookname | AddressBookType |
+----+------------+-----------+----------+--------+------------+---------+--------------+--------------------+-----------------+-----------------+
|  1 | Veeresh    | SB        | Haveri   | Haveri | Karnataka  |  588111 |    123456123 | veer@gmail.com     | AddressBook1    | Family          |
|  2 | Ronaldo    | CR        | Libson   | Porto  | Gao        |  500111 |    123456789 | cris@gmail.com     | AddressBook2    | Friend          |
|  4 | Mike       | gibbs     | LakeRoad | Hubli  | UP         |  581235 |    789654113 | mikeg@gmail.com    | AddressBook3    | Friend          |
|  5 | Paula      | Patrick   | Jaynagar | pune   | Maharastra | 5486845 |     39856214 | paulapat@gmail.com | AddressBook4    | Family          |
+----+------------+-----------+----------+--------+------------+---------+--------------+--------------------+-----------------+-----------------+
4 rows in set (0.05 sec)